Tester101|Ban traffic|03 10 2022 / 14:29|Transportation|In the middle of KU have a bad traffic today. Because of maintainace of road.|0|false
Tester101|Trash in park|03 10 2022 / 15:56|Environment|There are many trash on our park. We need someone to clear them all!|0|false
Tester101|I didn't get any scholarship|03 10 2022 / 16:02|Scholarship|I heard the announcement about scholarship, I am interested in this campaign. I had assign for three weeks now, and didn't get any reprot. Please help me.|0|false
Kevin99008|Lesson problem|03 10 2022 / 16:56|Education|I have problem with lesson that I have learn. I think it is not adavnce and not good for real life.|0|false
Kevin99008|Expensive parking|03 10 2022 / 17:01|Transportation|At KU AVENUE, they charge me very expensive. I think I got scam from officer who in charge there.|0|false
Tester101|I have a bad grade|04 10 2022 / 20:11|Education|I need turtor for teaching me this lesson. This is very hard subject. I need some help.|0|true
Tester101|รถน้ำมันหมด|05 10 2022 / 11:25|Transportation|น้ำมันหมดครับ แต่ไม่ต้องมาช่วยนะ พอดีรถเป็นไฮบริด|0|false
