Tester101|asdf|2022-10-16/14:49:10|Scholarship|2eee|default.jpg|||0|false|
Tester101|dasf|2022-10-16/15:23:32|Environment|afdasf|null|||1|false|Tester101,
Tester101|ads|2022-10-16/17:39:02|Environment|sdfwe|null|||0|false|
Tester101|EggFiredRice|2022-10-16/17:39:57|Environment|But this is Fired Egg|EggFiredRice.jpg|||0|false|
Tester101|I want money|2022-10-17/13:22:49|Scholarship|I need money for education|null|||0|false|
Tester101|Need more lesson|2022-10-17/14:14:34|Education|This subject didn't give ennough lesson to do this project|null|We will contract to your professor|Tester202|0|true|
Tester101|Want milk to make me smart|2022-10-17/14:52:12|Education|I need more milk!|Want milk to make me smart.jpg|||0|false|
Tester111|ท่อน้ำรั่ว|2022-10-17/17:19:25|Safety|ท่อน้ำรั่วที่ตึกSC45ชั้น8|ท่อน้ำรั่ว.png|||0|false|
Tester333|ขยะใต้ต้นไม้|2022-10-17/17:21:41|Environment|มีถุงขยะทิ้งอยู่ใต้ต้นไม้แถวบาร์ใหม่ส่งกลิ่นเหม็นไปทั่ว|ขยะใต้ต้นไม้.png|||0|false|
Tester101|ขยะข้างตึก|2022-10-17/17:25:01|Environment|มีเศษขยะอยู่ข้างตึกSC45|.png|||0|false|
Tester101|รถติด|2022-10-17/17:27:56|Traffic|รถติดหน้าประตูวิภาวดี ไม่มียามมาช่วยโบกรถ|null|||0|false|
